{
  "schemaVersion": 1,
  "os": "windows",
  "ae": {
    "major": "2025",
    "version": "25.0.0",
    "build": "example-build"
  },
  "candidate": {
    "runId": "1",
    "runAttempt": "1",
    "zxpSha256": "aaaaaaaaaaaaaaaaaaaaaaaaaaaaaaaaaaaaaaaaaaaaaaaaaaaaaaaaaaaaaaaa"
  },
  "validation": {
    "runId": "2",
    "runAttempt": "1"
  },
  "checks": {
    "installRemove": true,
    "menuPanel": true,
    "standard": true,
    "segmented": true,
    "demo": true,
    "standalone": true,
    "imagesFontsAudioExpressionsAnnotations": true,
    "essentialPropertiesGradientTextSlots": true,
    "pngPalettesAndPreservation": true,
    "iosAndroidReports": true,
    "localPreviewAndGzipPlayer": true,
    "serverRestartTokenRotation": true,
    "noUiFreeze": true,
    "canonicalDiffApproved": true
  },
  "human": {
    "reviewer": "example-maintainer",
    "approved": true
  },
  "harness": {
    "logArtifact": "ae-validation-windows-2025.log"
  }
}
